{
  "schema_version": "0.1.0",
  "event_id": "LE-143227",
  "run_id": "RUN-143227",
  "timestamp": "2026-02-04T14:32:27.850018Z",
  "node_id": "Q000011",
  "invariant_ids": [
    "I-000-000"
  ],
  "probe_refs": [
    "PO-143227"
  ],
  "channel_drift": {
    "primitive budget / silent premise": 0.0
  },
  "seam_flags": [],
  "decision": "retain",
  "notes": "probe_output_path=/home/frank-martinelli/pixel_vision/insideout_backwards/CI_LCG_Project_bootstrap_v0.1/CI_LCG_Project/houdini_package/output/probe_runs/PO-143227.json"
}
